{
  "$schema": "./test_cases.schema.json",
  "version": "1.0",
  "description": "FAgent 测试用例集",
  "updated_at": "2026-04-27",
  
  "test_suites": {
    "market_service": {
      "description": "Market Service 单元测试",
      "chain_profile": "legacy_direct",
      "module": "agents.common.market",
      "cases": [
        {
          "id": "MS001",
          "name": "A股行情查询-贵州茅台",
          "function": "market_service.get_quote",
          "input": {
            "symbol": "600519"
          },
          "expected": {
            "success": true,
            "fields": ["name", "symbol", "price", "change_pct", "trade_date"]
          },
          "expected_chain": {
            "must": [
              {
                "layer": "market_service",
                "event": "call",
                "name": "get_quote",
                "params": {
                  "symbol": { "eq": "600519" },
                  "market": { "eq": "a_share" }
                }
              },
              {
                "layer": "datasource",
                "event": "api_call",
                "name": "ak.stock_zh_a_spot_em"
              },
              {
                "layer": "market_service",
                "event": "result",
                "name": "get_quote",
                "success": true
              }
            ],
            "order": [
              "market_service.call:get_quote",
              "datasource.api_call:ak.stock_zh_a_spot_em",
              "market_service.result:get_quote:success"
            ]
          },
          "tags": ["a_share", "quote", "smoke"]
        },
        {
          "id": "MS002",
          "name": "A股行情查询-平安银行",
          "function": "market_service.get_quote",
          "input": {
            "symbol": "000001"
          },
          "expected": {
            "success": true,
            "fields": ["name", "symbol", "price"]
          },
          "expected_chain": {
            "must": [
              {
                "layer": "market_service",
                "event": "call",
                "name": "get_quote",
                "params": {
                  "symbol": { "eq": "000001" },
                  "market": { "eq": "a_share" }
                }
              },
              {
                "layer": "datasource",
                "event": "api_call",
                "name": "ak.stock_zh_a_spot_em"
              },
              {
                "layer": "market_service",
                "event": "result",
                "name": "get_quote",
                "success": true
              }
            ],
            "order": [
              "market_service.call:get_quote",
              "datasource.api_call:ak.stock_zh_a_spot_em",
              "market_service.result:get_quote:success"
            ]
          },
          "tags": ["a_share", "quote"]
        },
        {
          "id": "MS003",
          "name": "A股日K线-贵州茅台",
          "function": "market_service.get_kline",
          "input": {
            "symbol": "600519",
            "period": "DAILY",
            "count": 10
          },
          "expected": {
            "success": true,
            "data_count": 10,
            "fields": ["date", "open", "high", "low", "close", "volume"]
          },
          "expected_chain": {
            "must": [
              {
                "layer": "market_service",
                "event": "call",
                "name": "get_kline",
                "params": {
                  "symbol": { "eq": "600519" },
                  "market": { "eq": "a_share" },
                  "period": { "eq": "daily" },
                  "count": { "eq": 10 }
                }
              },
              {
                "layer": "datasource",
                "event": "api_call",
                "name": "ak.stock_zh_a_hist"
              },
              {
                "layer": "market_service",
                "event": "result",
                "name": "get_kline",
                "success": true
              }
            ],
            "order": [
              "market_service.call:get_kline",
              "datasource.api_call:ak.stock_zh_a_hist",
              "market_service.result:get_kline:success"
            ]
          },
          "tags": ["a_share", "kline"]
        },
        {
          "id": "MS004",
          "name": "股票搜索-茅台",
          "function": "market_service.search",
          "input": {
            "keyword": "茅台",
            "limit": 5
          },
          "expected": {
            "success": true,
            "min_results": 1,
            "contains_symbol": "600519"
          },
          "expected_chain": {
            "must": [
              {
                "layer": "market_service",
                "event": "call",
                "name": "search",
                "params": {
                  "keyword": { "eq": "茅台" },
                  "limit": { "eq": 5 }
                }
              },
              {
                "layer": "datasource",
                "event": "api_call",
                "name": "ak.stock_zh_a_spot_em"
              },
              {
                "layer": "market_service",
                "event": "result",
                "name": "search",
                "success": true
              }
            ],
            "order": [
              "market_service.call:search",
              "datasource.api_call:ak.stock_zh_a_spot_em",
              "market_service.result:search:success"
            ]
          },
          "tags": ["search"]
        },
        {
          "id": "MS005",
          "name": "股票搜索-银行",
          "function": "market_service.search",
          "input": {
            "keyword": "银行",
            "limit": 3
          },
          "expected": {
            "success": true,
            "min_results": 1
          },
          "expected_chain": {
            "must": [
              {
                "layer": "market_service",
                "event": "call",
                "name": "search",
                "params": {
                  "keyword": { "eq": "银行" },
                  "limit": { "eq": 3 }
                }
              },
              {
                "layer": "datasource",
                "event": "api_call",
                "name": "ak.stock_zh_a_spot_em"
              },
              {
                "layer": "market_service",
                "event": "result",
                "name": "search",
                "success": true
              }
            ],
            "order": [
              "market_service.call:search",
              "datasource.api_call:ak.stock_zh_a_spot_em",
              "market_service.result:search:success"
            ]
          },
          "tags": ["search"]
        }
      ]
    },
    
    "market_subagent": {
      "description": "Market SubAgent 集成测试",
      "chain_profile": "legacy_direct",
      "module": "agents.subagents.market_agent",
      "cases": [
        {
          "id": "MA001",
          "name": "行情查询意图",
          "function": "market_subagent.process",
          "input": {
            "intent": "GET_QUOTE",
            "symbol": "000001"
          },
          "expected": {
            "success": true,
            "has_summary": true
          },
          "expected_chain": {
            "must": [
              {
                "layer": "subagent",
                "event": "start",
                "name": "MarketSubAgent",
                "task": { "eq": "get_quote" }
              },
              {
                "layer": "subagent",
                "event": "tool_call",
                "name": "market_service.get_quote",
                "params": {
                  "symbol": { "eq": "000001" }
                }
              },
              {
                "layer": "market_service",
                "event": "call",
                "name": "get_quote",
                "params": {
                  "symbol": { "eq": "000001" },
                  "market": { "eq": "a_share" }
                }
              },
              {
                "layer": "datasource",
                "event": "api_call",
                "name": "ak.stock_zh_a_spot_em"
              },
              {
                "layer": "subagent",
                "event": "tool_result",
                "name": "market_service.get_quote",
                "success": true
              }
            ],
            "order": [
              "subagent.start:MarketSubAgent",
              "subagent.tool_call:market_service.get_quote",
              "market_service.call:get_quote",
              "datasource.api_call:ak.stock_zh_a_spot_em",
              "subagent.tool_result:market_service.get_quote:success",
              "subagent.done:MarketSubAgent:success"
            ]
          },
          "tags": ["subagent", "quote"]
        },
        {
          "id": "MA002",
          "name": "趋势分析意图",
          "function": "market_subagent.process",
          "input": {
            "intent": "ANALYZE_TREND",
            "symbol": "600519",
            "count": 30
          },
          "expected": {
            "success": true,
            "has_summary": true,
            "summary_contains": ["涨", "跌", "趋势"]
          },
          "expected_chain": {
            "must": [
              {
                "layer": "subagent",
                "event": "start",
                "name": "MarketSubAgent",
                "task": { "eq": "analyze_trend" }
              },
              {
                "layer": "subagent",
                "event": "tool_call",
                "name": "market_service.get_kline",
                "params": {
                  "symbol": { "eq": "600519" },
                  "period": { "eq": "daily" },
                  "count": { "eq": 50 }
                }
              },
              {
                "layer": "market_service",
                "event": "call",
                "name": "get_kline",
                "params": {